{
  "$schema": "../../schemas/recipe.schema.json",
  "schema_version": 1,
  "id": "8458be23-c890-5610-b887-43d7c981ce29",
  "slug": "old-fashioned-rhubarb-cobbler",
  "name": "Old Fashioned Rhubarb Cobbler",
  "recipe_type": "dessert",
  "brief_description": "This old-fashioned rhubarb cobbler is easy to make and tastes just like the cobbler grandma used to make.",
  "cuisine": "American",
  "instructions": [
    {
      "position": 1,
      "text": "Preheat the oven to 350 degrees F (175 degrees C)."
    },
    {
      "position": 2,
      "text": "Spread rhubarb into a 9x13-inch baking dish."
    },
    {
      "position": 3,
      "text": "Beat 3/4 cup white sugar and butter together in a bowl using an electric mixer until creamy and smooth; stir in flour, milk, baking powder, vanilla extract, and 1/2 teaspoon salt. Pour batter over rhubarb."
    },
    {
      "position": 4,
      "text": "Mix 1 cup sugar, cornstarch, and 1/4 teaspoon salt in a bowl; sprinkle over batter. Pour boiling water over sugar mixture."
    },
    {
      "position": 5,
      "text": "Bake in the preheated oven until cobbler is lightly browned, about 1 hour."
    }
  ],
  "servings": 12,
  "cooking_time_minutes": 60,
  "preparation_time_minutes": 30,
  "rest_time_minutes": null,
  "difficulty": "hard",
  "image_url": "https://github.com/ffimnsr/pepper-meal-recipes/raw/master/recipes/v1/assets/by-id/8458be23-c890-5610-b887-43d7c981ce29/cover.jpg",
  "video_url": null,
  "additional_media": [],
  "nutritional_information": {
    "@type": "NutritionInformation",
    "calories": "192 kcal",
    "carbohydrateContent": "40 g",
    "cholesterolContent": "8 mg",
    "fiberContent": "1 g",
    "proteinContent": "2 g",
    "saturatedFatContent": "2 g",
    "sodiumContent": "213 mg",
    "sugarContent": "30 g",
    "fatContent": "3 g",
    "unsaturatedFatContent": "0 g"
  },
  "dietary_labels": [],
  "allergens": [],
  "equipment": [],
  "ingredients": [
    {
      "ingredient_id": "411b9ea6-9c68-5cc2-98b5-87fd34573e99",
      "name": "rhubarb",
      "normalized_name": "rhubarb",
      "quantity": "3",
      "unit": "cups",
      "preparation": "or to taste, chopped",
      "position": 1
    },
    {
      "ingredient_id": "fd1f5f7a-51aa-571d-8496-fa035af63968",
      "name": "white sugar",
      "normalized_name": "white sugar",
      "quantity": "0.75",
      "unit": "cup",
      "preparation": null,
      "position": 2
    },
    {
      "ingredient_id": "bbfbf60f-39b8-5e5a-9815-eba35d54e9b9",
      "name": "butter",
      "normalized_name": "butter",
      "quantity": "3",
      "unit": "tablespoons",
      "preparation": null,
      "position": 3
    },
    {
      "ingredient_id": "7ecff7d5-73ac-52f8-b020-2182bde86cbe",
      "name": "all-purpose flour",
      "normalized_name": "all-purpose flour",
      "quantity": "1",
      "unit": "cup",
      "preparation": null,
      "position": 4
    },
    {
      "ingredient_id": "0c7dce79-bb52-51bd-80b3-d398ccad9956",
      "name": "milk",
      "normalized_name": "milk",
      "quantity": "0.5",
      "unit": "cup",
      "preparation": null,
      "position": 5
    },
    {
      "ingredient_id": "2c01b926-610a-5149-9b15-e41677ad896e",
      "name": "baking powder",
      "normalized_name": "baking powder",
      "quantity": "1",
      "unit": "teaspoon",
      "preparation": null,
      "position": 6
    },
    {
      "ingredient_id": "919ee8c0-02db-5f41-908d-ed4aefee84c2",
      "name": "vanilla extract",
      "normalized_name": "vanilla extract",
      "quantity": "1",
      "unit": "teaspoon",
      "preparation": null,
      "position": 7
    },
    {
      "ingredient_id": "5158b18a-f73d-5768-a133-6b6c21cf5e98",
      "name": "salt",
      "normalized_name": "salt",
      "quantity": "0.5",
      "unit": "teaspoon",
      "preparation": null,
      "position": 8
    },
    {
      "ingredient_id": "fd1f5f7a-51aa-571d-8496-fa035af63968",
      "name": "white sugar",
      "normalized_name": "white sugar",
      "quantity": "1",
      "unit": "cup",
      "preparation": null,
      "position": 9
    },
    {
      "ingredient_id": "da428c7a-4c41-5d56-821c-037b68ae6c10",
      "name": "cornstarch",
      "normalized_name": "cornstarch",
      "quantity": "1",
      "unit": "tablespoon",
      "preparation": null,
      "position": 10
    },
    {
      "ingredient_id": "5158b18a-f73d-5768-a133-6b6c21cf5e98",
      "name": "salt",
      "normalized_name": "salt",
      "quantity": "0.25",
      "unit": "teaspoon",
      "preparation": null,
      "position": 11
    },
    {
      "ingredient_id": "d72b2051-e25f-52e6-9254-2ff83a376f80",
      "name": "boiling water",
      "normalized_name": "boiling water",
      "quantity": "1",
      "unit": "cup",
      "preparation": null,
      "position": 12
    }
  ],
  "categories": [
    {
      "id": "f478616f-a55d-517b-9b00-0fdd6d81e364",
      "slug": "dessert",
      "name": "Dessert"
    },
    {
      "id": "39bf14f6-9424-54fe-b13a-16e33371198f",
      "slug": "desserts",
      "name": "Desserts"
    },
    {
      "id": "88ef7ffc-d6ba-5e6d-9959-40c87cf3a5a9",
      "slug": "cobblers",
      "name": "Cobblers"
    },
    {
      "id": "8ef35883-a7f2-58a0-bedc-df8d754a278a",
      "slug": "rhubarb-cobbler",
      "name": "Rhubarb Cobbler"
    }
  ],
  "tags": [
    {
      "id": "82bcd0ac-928f-57ef-a8f6-3cd56d132e10",
      "slug": "rhubarb-cobbler-recipes",
      "name": "Rhubarb Cobbler Recipes",
      "color": null
    },
    {
      "id": "7ff1c9ba-0da2-5888-a251-1b56d3c30f6f",
      "slug": "fruit-desserts",
      "name": "Fruit Desserts",
      "color": null
    },
    {
      "id": "5dd9b831-f00f-5624-b250-989d61748753",
      "slug": "rhubarb",
      "name": "Rhubarb",
      "color": null
    },
    {
      "id": "164d4127-2765-5952-8f24-ca336b15d5d6",
      "slug": "more-meal-ideas",
      "name": "More Meal Ideas",
      "color": null
    },
    {
      "id": "37c47145-6a57-5f00-aedc-b57a6031ee8e",
      "slug": "extracts-and-flavoring-recipes",
      "name": "Extracts and Flavoring Recipes",
      "color": null
    },
    {
      "id": "a5498448-4eed-5644-b17d-c8a3be003218",
      "slug": "vanilla-extract-recipes",
      "name": "Vanilla Extract Recipes",
      "color": null
    },
    {
      "id": "4df3c995-92b0-5b26-81f3-a37a2a681eab",
      "slug": "retro-recipes",
      "name": "Retro Recipes",
      "color": null
    },
    {
      "id": "ff9f6e55-9805-5f03-8f74-1db2d6de7c92",
      "slug": "desserts",
      "name": "Desserts",
      "color": null
    },
    {
      "id": "038bebf6-15b1-553f-8a1d-94f11ace5695",
      "slug": "cobblers",
      "name": "Cobblers",
      "color": null
    },
    {
      "id": "d973058a-9399-5a14-8984-d2e05a1e29f9",
      "slug": "ingredients",
      "name": "Ingredients",
      "color": null
    }
  ],
  "related_recipe_ids": [],
  "recipe_notes": [],
  "storage_notes": [],
  "source": {
    "name": "Allrecipes",
    "url": "https://www.allrecipes.com/recipe/233077/old-fashioned-rhubarb-cobbler"
  },
  "public": true,
  "updated_at": 1791044581,
  "revision": 1
}
