{
  "$schema": "../../schemas/recipe.schema.json",
  "schema_version": 1,
  "id": "c4d7ff56-5889-55fa-a6fb-4426877bf087",
  "slug": "peach-cosmo",
  "name": "Peach Cosmo",
  "recipe_type": "drink",
  "brief_description": "I was making a peach cosmopolitan and didn’t have any triple sec, so I used peach schnapps and loved it.",
  "cuisine": "American",
  "instructions": [
    {
      "position": 1,
      "text": "Fill a cocktail shaker with ice. Add cranberry juice, vodka, schnapps, and lime juice. Cover and shake until the outside of the shaker has frosted. Strain into a chilled martini glass to serve."
    }
  ],
  "servings": 1,
  "cooking_time_minutes": null,
  "preparation_time_minutes": 5,
  "rest_time_minutes": null,
  "difficulty": "easy",
  "image_url": "https://github.com/ffimnsr/pepper-meal-recipes/raw/master/recipes/v1/assets/by-id/c4d7ff56-5889-55fa-a6fb-4426877bf087/cover.jpg",
  "video_url": null,
  "additional_media": [],
  "nutritional_information": null,
  "dietary_labels": [],
  "allergens": [],
  "equipment": [],
  "ingredients": [
    {
      "ingredient_id": "f1102ddd-a1a6-5f8a-934f-666143834e15",
      "name": "ice",
      "normalized_name": "ice",
      "quantity": null,
      "unit": "pieces",
      "preparation": null,
      "position": 1
    },
    {
      "ingredient_id": "f9dfdc93-cf9a-5c7b-845a-1b9673fd46bc",
      "name": "fluid ounces cranberry juice",
      "normalized_name": "fluid ounces cranberry juice",
      "quantity": "3",
      "unit": "pieces",
      "preparation": null,
      "position": 2
    },
    {
      "ingredient_id": "da7fdbe7-4bd4-5c15-bcc5-c7da04903a9f",
      "name": "jigger citron vodka",
      "normalized_name": "jigger citron vodka",
      "quantity": "1.5",
      "unit": "ounce",
      "preparation": null,
      "position": 3
    },
    {
      "ingredient_id": "6c49ef17-f65d-59a8-9968-56494dc262d5",
      "name": "peach schnapps",
      "normalized_name": "peach schnapps",
      "quantity": "1",
      "unit": "tablespoon",
      "preparation": null,
      "position": 4
    },
    {
      "ingredient_id": "0e66765e-3fa2-52b8-bd89-520e4935a12f",
      "name": "fresh lime juice",
      "normalized_name": "fresh lime juice",
      "quantity": "1",
      "unit": "teaspoon",
      "preparation": null,
      "position": 5
    }
  ],
  "categories": [
    {
      "id": "715aee19-0731-5b98-885c-ed07e7e66e9d",
      "slug": "drink",
      "name": "Drink"
    },
    {
      "id": "bf7a8a39-9600-5ef7-a033-6690a7aa3bfc",
      "slug": "beverage",
      "name": "Beverage"
    },
    {
      "id": "796a0b91-6fc7-556a-919a-a1c3a4f93df3",
      "slug": "drinks",
      "name": "Drinks"
    },
    {
      "id": "4fe9efe4-15fd-5f94-9961-25de12b74509",
      "slug": "cocktail",
      "name": "Cocktail"
    },
    {
      "id": "8b5bd7ff-05ba-5d0f-a3e6-550a9a8b7b65",
      "slug": "cosmopolitan",
      "name": "Cosmopolitan"
    }
  ],
  "tags": [
    {
      "id": "08fe6f78-ce7e-5e84-a5da-8b9f0414f24b",
      "slug": "father-s-day",
      "name": "Father's Day",
      "color": null
    },
    {
      "id": "e09cd98a-c038-53f2-b08a-00f6534987bc",
      "slug": "recipes",
      "name": "Recipes",
      "color": null
    },
    {
      "id": "2cbb4e2e-81e1-56b2-b60d-e470f8595c8c",
      "slug": "entertaining",
      "name": "Entertaining",
      "color": null
    },
    {
      "id": "824adb05-72ef-5e2d-bfb4-c37dc6a6795e",
      "slug": "drinks",
      "name": "Drinks",
      "color": null
    },
    {
      "id": "840deae6-2f08-5791-98ce-ba6b2a2d6264",
      "slug": "cosmopolitan-recipes",
      "name": "Cosmopolitan Recipes",
      "color": null
    },
    {
      "id": "3e15e093-b465-5738-bc6e-2753b83b9383",
      "slug": "adult-punch-recipes",
      "name": "Adult Punch Recipes",
      "color": null
    },
    {
      "id": "f0decdd4-0259-5932-b65f-943543dd4242",
      "slug": "cocktail-recipes",
      "name": "Cocktail Recipes",
      "color": null
    },
    {
      "id": "33c65ebf-4a9f-50fd-8f6d-d6eb59c2dfdf",
      "slug": "drinks-recipes",
      "name": "Drinks Recipes",
      "color": null
    },
    {
      "id": "fbee07d6-4c92-53e3-9319-82c2ded63e02",
      "slug": "vodka-drinks-recipes",
      "name": "Vodka Drinks Recipes",
      "color": null
    },
    {
      "id": "74b8c516-3275-59d2-bea4-7bb2c884ae07",
      "slug": "punch-recipes",
      "name": "Punch Recipes",
      "color": null
    }
  ],
  "related_recipe_ids": [],
  "recipe_notes": [],
  "storage_notes": [],
  "source": {
    "name": "Allrecipes",
    "url": "https://www.allrecipes.com/recipe/110218/peach-cosmo"
  },
  "public": true,
  "updated_at": 1790949860,
  "revision": 1
}
