{
  "$schema": "../../schemas/recipe.schema.json",
  "schema_version": 1,
  "id": "c0039b40-71f1-5c84-94f3-1db5b31221b8",
  "slug": "kellys-ham-jell-o-salad",
  "name": "Kelly's Ham Jell-O Salad",
  "recipe_type": "salad",
  "brief_description": "This savory Jell-O salad is made with cabbage, chopped ham, mayonnaise, and spicy brown mustard.",
  "cuisine": null,
  "instructions": [
    {
      "position": 1,
      "text": "Dissolve lemon gelatin in boiling water in a large bowl. Pour reserved pineapple juice and white wine vinegar into a measuring cup; add enough cold water to measure 1 cup. Stir water-juice mixture into gelatin mixture; refrigerate until cold and beginning to set, about 30 minutes."
    },
    {
      "position": 2,
      "text": "Stir mayonnaise and spicy brown mustard together in a bowl; whisk mayonnaise mixture into cooled lemon gelatin mixture until smooth. Gently fold cabbage, ham, celery, and reserved pineapple into gelatin. Transfer mixture into a ring-shaped gelatin mold."
    },
    {
      "position": 3,
      "text": "Chill in the refrigerator until firmly set, about 4 hours."
    },
    {
      "position": 4,
      "text": "To serve, dip the gelatin mold into hot water to loosen the sides; place a plate on top of the mold, invert, and gently lift the mold from salad."
    }
  ],
  "servings": 8,
  "cooking_time_minutes": null,
  "preparation_time_minutes": 20,
  "rest_time_minutes": null,
  "difficulty": "easy",
  "image_url": "https://github.com/ffimnsr/pepper-meal-recipes/raw/master/recipes/v1/assets/by-id/c0039b40-71f1-5c84-94f3-1db5b31221b8/cover.jpg",
  "video_url": "https://content.jwplatform.com/videos/XBQhHN3G-K3AjnAEN.mp4",
  "additional_media": [],
  "nutritional_information": {
    "@type": "NutritionInformation",
    "calories": "200 kcal",
    "carbohydrateContent": "15 g",
    "cholesterolContent": "15 mg",
    "fiberContent": "1 g",
    "proteinContent": "5 g",
    "saturatedFatContent": "3 g",
    "sodiumContent": "378 mg",
    "sugarContent": "14 g",
    "fatContent": "14 g",
    "unsaturatedFatContent": "0 g"
  },
  "dietary_labels": [],
  "allergens": [],
  "equipment": [],
  "ingredients": [
    {
      "ingredient_id": "8b975e0b-5ea4-57ed-adb2-92e7a5fbfc5f",
      "name": "lemon-flavored gelatin mix such as jell-o",
      "normalized_name": "lemon-flavored gelatin mix such as jell-o",
      "quantity": "3",
      "unit": "ounce",
      "preparation": null,
      "position": 1
    },
    {
      "ingredient_id": "d72b2051-e25f-52e6-9254-2ff83a376f80",
      "name": "boiling water",
      "normalized_name": "boiling water",
      "quantity": "1",
      "unit": "cup",
      "preparation": null,
      "position": 2
    },
    {
      "ingredient_id": "0656341c-be4c-5591-b278-03a75a6d350f",
      "name": "crushed pineapple in juice",
      "normalized_name": "crushed pineapple in juice",
      "quantity": "8",
      "unit": "ounce",
      "preparation": "drained and juice reserved",
      "position": 3
    },
    {
      "ingredient_id": "54ab7daa-52f3-5fe6-8ea9-272aa4955243",
      "name": "white wine vinegar",
      "normalized_name": "white wine vinegar",
      "quantity": "1.5",
      "unit": "tablespoons",
      "preparation": null,
      "position": 4
    },
    {
      "ingredient_id": "b94296dc-9e1a-5dad-9dc2-727ad66f0055",
      "name": "cold water",
      "normalized_name": "cold water",
      "quantity": "0.5",
      "unit": "cup",
      "preparation": "or as needed",
      "position": 5
    },
    {
      "ingredient_id": "6ea5f8d5-8561-5016-bb89-5cd67e359896",
      "name": "mayonnaise",
      "normalized_name": "mayonnaise",
      "quantity": "0.5",
      "unit": "cup",
      "preparation": null,
      "position": 6
    },
    {
      "ingredient_id": "be58ca37-5136-5130-aa1b-3c4ebfadcb79",
      "name": "spicy brown mustard",
      "normalized_name": "spicy brown mustard",
      "quantity": "2",
      "unit": "teaspoons",
      "preparation": "or to taste",
      "position": 7
    },
    {
      "ingredient_id": "f6813353-eae4-5169-a906-e01d96838e85",
      "name": "finely chopped cabbage",
      "normalized_name": "finely chopped cabbage",
      "quantity": "1",
      "unit": "cup",
      "preparation": null,
      "position": 8
    },
    {
      "ingredient_id": "ea6dc703-7138-5d94-a1f2-31f598736ea0",
      "name": "chopped celery",
      "normalized_name": "chopped celery",
      "quantity": "0.5",
      "unit": "cup",
      "preparation": null,
      "position": 9
    },
    {
      "ingredient_id": "2d3ce44a-2da2-5939-8ac2-21826822e0f7",
      "name": "chopped cooked ham",
      "normalized_name": "chopped cooked ham",
      "quantity": "1",
      "unit": "cup",
      "preparation": null,
      "position": 10
    }
  ],
  "categories": [
    {
      "id": "f478616f-a55d-517b-9b00-0fdd6d81e364",
      "slug": "dessert",
      "name": "Dessert"
    },
    {
      "id": "8b0dba29-8913-5fd3-966c-dce7a0d9cf59",
      "slug": "main-dishes",
      "name": "Main Dishes"
    },
    {
      "id": "9e47cf4e-6a45-5036-b001-ab987b9aff72",
      "slug": "pork",
      "name": "Pork"
    },
    {
      "id": "fd5fb16c-97cc-5599-bbab-deb14b0c5f9e",
      "slug": "ham",
      "name": "Ham"
    }
  ],
  "tags": [
    {
      "id": "8d8fef2a-121c-5863-9b4b-5480445e924f",
      "slug": "ham",
      "name": "Ham",
      "color": null
    },
    {
      "id": "164d4127-2765-5952-8f24-ca336b15d5d6",
      "slug": "more-meal-ideas",
      "name": "More Meal Ideas",
      "color": null
    },
    {
      "id": "d6d50787-a8f4-51f2-a94a-2d78cce6477b",
      "slug": "pork",
      "name": "Pork",
      "color": null
    },
    {
      "id": "476d77c7-a332-5fe4-a6a1-ebd36e74ebd8",
      "slug": "jell-o-desserts",
      "name": "Jell-O® Desserts",
      "color": null
    },
    {
      "id": "a0e4c03c-79e3-5259-86bf-c9998b753374",
      "slug": "dessert-salad-recipes",
      "name": "Dessert Salad Recipes",
      "color": null
    },
    {
      "id": "539b677d-7236-50cc-982b-5530002f646f",
      "slug": "1950s",
      "name": "1950s",
      "color": null
    },
    {
      "id": "b0b3e2ff-eb7f-5c81-aa04-939e63ae2606",
      "slug": "jell-o-salad",
      "name": "Jell-O® Salad",
      "color": null
    },
    {
      "id": "4df3c995-92b0-5b26-81f3-a37a2a681eab",
      "slug": "retro-recipes",
      "name": "Retro Recipes",
      "color": null
    },
    {
      "id": "ff9f6e55-9805-5f03-8f74-1db2d6de7c92",
      "slug": "desserts",
      "name": "Desserts",
      "color": null
    }
  ],
  "related_recipe_ids": [],
  "recipe_notes": [],
  "storage_notes": [],
  "source": {
    "name": "Allrecipes",
    "url": "https://www.allrecipes.com/recipe/229938/kellys-ham-jell-o-salad"
  },
  "public": true,
  "updated_at": 1790949860,
  "revision": 1
}
