{
  "$schema": "../../schemas/recipe.schema.json",
  "schema_version": 1,
  "id": "58794469-aedd-582d-a7f2-feeabafef976",
  "slug": "chicken-bacon-ranch-tater-tot-casserole-recipe-8751351",
  "name": "Chicken Bacon Ranch Tater Tot Casserole",
  "recipe_type": "main",
  "brief_description": "Chicken Bacon Ranch Tater Tot Casserole combines crispy tater tots, creamy ranch, savory chicken, and smoky bacon for the ultimate comfort food dish. Loaded with shortcuts, this easy recipe is perfect for a weeknight dinner.",
  "cuisine": "American",
  "instructions": [
    {
      "position": 1,
      "text": "Gather all ingredients. Preheat oven to 450 degrees F (200 degrees C). Lightly coat a 9x13-inch baking dish with cooking spray."
    },
    {
      "position": 2,
      "text": "Spread potato tots on a large baking sheet into an even layer."
    },
    {
      "position": 3,
      "text": "Bake in the preheated oven until golden and crispy, about 35 minutes. Remove from oven and set aside. Reduce oven temperature to 375 degrees F (190 degrees C)."
    },
    {
      "position": 4,
      "text": "While potato tots cook, whisk together cream of chicken soup, sour cream, ranch dressing, ranch dressing mix, black pepper, and granulated garlic in a large bowl until thoroughly combined. Fold in chicken, Cheddar, and 1 cup of the cooked bacon until fully coated in sour cream mixture."
    },
    {
      "position": 5,
      "text": "Transfer chicken mixture to prepared baking dish and spread it into an even layer. Top evenly with cooked potato tots. Bake in preheated oven until bubbling around edges, 30 to 35 minutes."
    },
    {
      "position": 6,
      "text": "Sprinkle evenly with remaining 1/4 cup cooked bacon; garnish with scallions. Recipe developed by Craig Ruff"
    }
  ],
  "servings": 8,
  "cooking_time_minutes": 65,
  "preparation_time_minutes": 15,
  "rest_time_minutes": null,
  "difficulty": "hard",
  "image_url": "https://github.com/ffimnsr/pepper-meal-recipes/raw/master/recipes/v1/assets/by-id/58794469-aedd-582d-a7f2-feeabafef976/cover.jpg",
  "video_url": "https://content.jwplatform.com/videos/5dRo4lmC-K3AjnAEN.mp4",
  "additional_media": [],
  "nutritional_information": {
    "@type": "NutritionInformation",
    "calories": "823 kcal",
    "carbohydrateContent": "39 g",
    "cholesterolContent": "225 mg",
    "fiberContent": "3 g",
    "proteinContent": "49 g",
    "saturatedFatContent": "15 g",
    "sodiumContent": "2106 mg",
    "sugarContent": "3 g",
    "fatContent": "53 g",
    "unsaturatedFatContent": "0 g"
  },
  "dietary_labels": [],
  "allergens": [],
  "equipment": [],
  "ingredients": [
    {
      "ingredient_id": "e3f54bad-2d2b-58c2-9381-0d0ac86db3fd",
      "name": "cooking spray",
      "normalized_name": "cooking spray",
      "quantity": null,
      "unit": "pieces",
      "preparation": null,
      "position": 1
    },
    {
      "ingredient_id": "8905cdd7-4a34-581f-a19a-47d3c3cb457d",
      "name": "frozen potato tots such as ore-ida crispy tater tots",
      "normalized_name": "frozen potato tots such as ore-ida crispy tater tots",
      "quantity": "32",
      "unit": "ounce",
      "preparation": null,
      "position": 2
    },
    {
      "ingredient_id": "baceb104-63f2-53be-a838-83fbb9ddbe71",
      "name": "cream of chicken soup such as campbell’s",
      "normalized_name": "cream of chicken soup such as campbells",
      "quantity": "10.5",
      "unit": "ounce",
      "preparation": null,
      "position": 3
    },
    {
      "ingredient_id": "2a756a13-d9a1-5257-b678-486a4ab2ac3d",
      "name": "sour cream",
      "normalized_name": "sour cream",
      "quantity": "1",
      "unit": "cup",
      "preparation": null,
      "position": 4
    },
    {
      "ingredient_id": "3394cd52-6405-5271-86b1-11432d59786c",
      "name": "ranch dressing",
      "normalized_name": "ranch dressing",
      "quantity": "2/3",
      "unit": "cup",
      "preparation": null,
      "position": 5
    },
    {
      "ingredient_id": "640da650-7e00-5fa8-9935-c245d1f97ede",
      "name": "ranch dressing mix",
      "normalized_name": "ranch dressing mix",
      "quantity": "1",
      "unit": "ounce",
      "preparation": null,
      "position": 6
    },
    {
      "ingredient_id": "f3daab85-fd5d-56c3-a1a7-aced8f06b15b",
      "name": "cracked black pepper",
      "normalized_name": "cracked black pepper",
      "quantity": "1/2",
      "unit": "teaspoon",
      "preparation": null,
      "position": 7
    },
    {
      "ingredient_id": "69d58e83-e835-5070-bc11-6e34687b3689",
      "name": "granulated garlic",
      "normalized_name": "granulated garlic",
      "quantity": "1/2",
      "unit": "teaspoon",
      "preparation": null,
      "position": 8
    },
    {
      "ingredient_id": "d74e359a-64be-5c46-8846-388ba41cb8bb",
      "name": "rotisserie chicken",
      "normalized_name": "rotisserie chicken",
      "quantity": "5",
      "unit": "cups",
      "preparation": "shredded, from 1 chicken",
      "position": 9
    },
    {
      "ingredient_id": "0434be6a-5c10-58c5-8b40-7239921d3b3e",
      "name": "sharp cheddar cheese",
      "normalized_name": "sharp cheddar cheese",
      "quantity": "4",
      "unit": "ounces",
      "preparation": "shredded (about 1 cup)",
      "position": 10
    },
    {
      "ingredient_id": "14a9821b-6966-5d2b-a09e-837355f37cb5",
      "name": "bacon",
      "normalized_name": "bacon",
      "quantity": "1 1/4",
      "unit": "cups",
      "preparation": "divided, crumbled, from 10 slice",
      "position": 11
    },
    {
      "ingredient_id": "4b1680a6-1b41-5445-ad43-3411d653d678",
      "name": "scallion",
      "normalized_name": "scallion",
      "quantity": null,
      "unit": "pieces",
      "preparation": "sliced",
      "position": 12
    }
  ],
  "categories": [
    {
      "id": "d5c62f68-5499-559d-bca9-20a6e57a3973",
      "slug": "dinner",
      "name": "Dinner"
    },
    {
      "id": "017f8645-ec08-59b4-a868-cdf69e504615",
      "slug": "entree",
      "name": "Entree"
    },
    {
      "id": "8b0dba29-8913-5fd3-966c-dce7a0d9cf59",
      "slug": "main-dishes",
      "name": "Main Dishes"
    },
    {
      "id": "3386fde0-c04b-5802-ac56-e84c4bf4c201",
      "slug": "casserole",
      "name": "Casserole"
    },
    {
      "id": "24e3743e-25a0-58f6-8029-8741b37c8156",
      "slug": "vegetable",
      "name": "Vegetable"
    },
    {
      "id": "acdd8901-89c7-5bf4-b153-f4ffbcced0e1",
      "slug": "tater-tots",
      "name": "Tater Tots®"
    }
  ],
  "tags": [
    {
      "id": "c023f237-ae4d-5d19-9dd0-3dba6929b77e",
      "slug": "publisher-tested",
      "name": "publisher-tested",
      "color": null
    },
    {
      "id": "d973058a-9399-5a14-8984-d2e05a1e29f9",
      "slug": "ingredients",
      "name": "Ingredients",
      "color": null
    },
    {
      "id": "9cf68866-86d9-5e5c-b2bb-8aee57b14df0",
      "slug": "comfort-food-recipes",
      "name": "Comfort Food Recipes",
      "color": null
    },
    {
      "id": "ec9d976e-4296-5c34-88a4-518d14e86e0b",
      "slug": "allrecipes",
      "name": "Allrecipes",
      "color": null
    },
    {
      "id": "5cbef1ad-97d6-5865-b449-7a20d19ea679",
      "slug": "tater-tots",
      "name": "Tater Tots®",
      "color": null
    },
    {
      "id": "e09cd98a-c038-53f2-b08a-00f6534987bc",
      "slug": "recipes",
      "name": "Recipes",
      "color": null
    },
    {
      "id": "fd530a9b-dab2-56e0-be6a-0fc756feeba9",
      "slug": "casserole-recipes",
      "name": "Casserole Recipes",
      "color": null
    },
    {
      "id": "eda43a7d-cd1e-531a-868f-b6a5d61f13f4",
      "slug": "chicken",
      "name": "Chicken",
      "color": null
    },
    {
      "id": "4862ebea-a876-5ebb-af5f-d2db60240020",
      "slug": "dinner",
      "name": "Dinner",
      "color": null
    },
    {
      "id": "14f8b185-3b14-5647-8706-acca91b13af0",
      "slug": "main-dishes",
      "name": "Main Dishes",
      "color": null
    },
    {
      "id": "f204ad59-07f2-573c-992f-dbc6e82b8552",
      "slug": "meat-and-poultry",
      "name": "Meat and Poultry",
      "color": null
    }
  ],
  "related_recipe_ids": [],
  "recipe_notes": [],
  "storage_notes": [],
  "source": {
    "name": "Allrecipes",
    "url": "https://www.allrecipes.com/chicken-bacon-ranch-tater-tot-casserole-recipe-8751351"
  },
  "public": true,
  "updated_at": 1791045503,
  "revision": 1
}
