{
  "$schema": "../../schemas/recipe.schema.json",
  "schema_version": 1,
  "id": "71634472-e162-5c0b-9d00-82a747204c2a",
  "slug": "gorgonzola-and-wild-mushroom-risotto",
  "name": "Creamy Wild Mushroom Risotto",
  "recipe_type": "main",
  "brief_description": "Wild mushroom risotto with dried chanterelles, fresh mushrooms, garlic, white wine, and truffle oil; top with Gorgonzola for a rich and creamy main dish.",
  "cuisine": "Italian",
  "instructions": [
    {
      "position": 1,
      "text": "Cover chanterelle mushrooms with hot water, cover, and set aside to soften for 30 minutes. Once soft, remove mushrooms from water and chop; discard water."
    },
    {
      "position": 2,
      "text": "Melt butter along with truffle oil in a large saucepan over medium-high heat. Add onion, shallot, and garlic; cook and stir two minutes until the onion begins to soften. Add fresh mushrooms; continue cooking until mushroom softens and begin to release their liquid. Stir in chopped chanterelle mushrooms, and cook 3 minutes more."
    },
    {
      "position": 3,
      "text": "Add Arborio rice; cook and stir for a few minutes until rice looks glossy and is well coated with onion mixture. Stir in white wine and cook until nearly evaporated."
    },
    {
      "position": 4,
      "text": "Reduce heat to medium; add 1/3 of the hot chicken stock. Cook and stir until chicken stock has been mostly absorbed, about 5 minutes. The risotto should be simmering gently while you stir in chicken stock. Add 1/2 of the remaining stock, and stir for 5 minutes more. Finally add remaining stock, and continue cooking until risotto is creamy and rice is tender, about 5 minutes more. The rice should not be completely soft, but still have a little firmness when you bite into it. You can add a little water if needed to cook the rice to this state."
    },
    {
      "position": 5,
      "text": "Remove risotto from the heat, and stir in heavy cream and Gorgonzola cheese. Season to taste with salt and pepper, and serve."
    }
  ],
  "servings": 4,
  "cooking_time_minutes": 25,
  "preparation_time_minutes": 20,
  "rest_time_minutes": null,
  "difficulty": "medium",
  "image_url": "https://github.com/ffimnsr/pepper-meal-recipes/raw/master/recipes/v1/assets/by-id/71634472-e162-5c0b-9d00-82a747204c2a/cover.jpg",
  "video_url": null,
  "additional_media": [],
  "nutritional_information": {
    "@type": "NutritionInformation",
    "calories": "321 kcal",
    "carbohydrateContent": "44 g",
    "cholesterolContent": "23 mg",
    "fiberContent": "3 g",
    "proteinContent": "11 g",
    "saturatedFatContent": "4 g",
    "sodiumContent": "413 mg",
    "sugarContent": "9 g",
    "fatContent": "9 g",
    "unsaturatedFatContent": "0 g"
  },
  "dietary_labels": [],
  "allergens": [],
  "equipment": [],
  "ingredients": [
    {
      "ingredient_id": "9167c363-7261-5f7d-9871-a03f299b4501",
      "name": "dried chanterelle mushrooms",
      "normalized_name": "dried chanterelle mushrooms",
      "quantity": "2",
      "unit": "ounces",
      "preparation": null,
      "position": 1
    },
    {
      "ingredient_id": "bbfbf60f-39b8-5e5a-9815-eba35d54e9b9",
      "name": "butter",
      "normalized_name": "butter",
      "quantity": "1.5",
      "unit": "teaspoons",
      "preparation": null,
      "position": 2
    },
    {
      "ingredient_id": "0b817789-8a06-5a63-94c0-226c7cbb1280",
      "name": "truffle oil",
      "normalized_name": "truffle oil",
      "quantity": "1",
      "unit": "teaspoon",
      "preparation": null,
      "position": 3
    },
    {
      "ingredient_id": "84b3e4e5-f16f-5720-813f-8fae26445446",
      "name": "chopped onion",
      "normalized_name": "chopped onion",
      "quantity": "1",
      "unit": "piece",
      "preparation": null,
      "position": 4
    },
    {
      "ingredient_id": "195dd91b-7e16-5008-af4e-050104514749",
      "name": "shallots",
      "normalized_name": "shallots",
      "quantity": "2",
      "unit": "pieces",
      "preparation": "minced",
      "position": 5
    },
    {
      "ingredient_id": "0730a53d-031c-5767-ae83-cfc26b8dc9c6",
      "name": "garlic",
      "normalized_name": "garlic",
      "quantity": "1",
      "unit": "clove",
      "preparation": "minced",
      "position": 6
    },
    {
      "ingredient_id": "a914c6c9-f11d-54cb-9ffd-d7891aaeda49",
      "name": "sliced fresh button mushrooms",
      "normalized_name": "sliced fresh button mushrooms",
      "quantity": "3",
      "unit": "ounces",
      "preparation": null,
      "position": 7
    },
    {
      "ingredient_id": "8d81d57c-0ce8-53da-ad55-62db413112f6",
      "name": "arborio rice",
      "normalized_name": "arborio rice",
      "quantity": "12",
      "unit": "ounce",
      "preparation": null,
      "position": 8
    },
    {
      "ingredient_id": "32c068b2-dc92-5c1c-85e9-b0c98004f775",
      "name": "dry white wine",
      "normalized_name": "dry white wine",
      "quantity": "0.5",
      "unit": "cup",
      "preparation": null,
      "position": 9
    },
    {
      "ingredient_id": "907550af-7fbb-5de2-ac98-4914c6cf022c",
      "name": "quart hot chicken stock",
      "normalized_name": "quart hot chicken stock",
      "quantity": "1",
      "unit": "piece",
      "preparation": null,
      "position": 10
    },
    {
      "ingredient_id": "cffb5e15-5a8c-563b-b1a2-bf3a76c123c8",
      "name": "heavy cream",
      "normalized_name": "heavy cream",
      "quantity": "2",
      "unit": "tablespoons",
      "preparation": null,
      "position": 11
    },
    {
      "ingredient_id": "4c6b3835-acc0-58b2-8610-2581253751c4",
      "name": "crumbled gorgonzola cheese",
      "normalized_name": "crumbled gorgonzola cheese",
      "quantity": "2",
      "unit": "tablespoons",
      "preparation": "or to taste",
      "position": 12
    },
    {
      "ingredient_id": "061815cc-d359-57b4-9f13-848613fb6cce",
      "name": "ground black pepper to taste",
      "normalized_name": "ground black pepper to taste",
      "quantity": null,
      "unit": "pieces",
      "preparation": null,
      "position": 13
    }
  ],
  "categories": [
    {
      "id": "d5c62f68-5499-559d-bca9-20a6e57a3973",
      "slug": "dinner",
      "name": "Dinner"
    },
    {
      "id": "8b0dba29-8913-5fd3-966c-dce7a0d9cf59",
      "slug": "main-dishes",
      "name": "Main Dishes"
    },
    {
      "id": "22a78597-cd9e-5600-bf93-35c536090442",
      "slug": "rice",
      "name": "Rice"
    },
    {
      "id": "01359e67-e8a2-58b2-9547-4595faf03021",
      "slug": "risotto",
      "name": "Risotto"
    }
  ],
  "tags": [
    {
      "id": "26d199b5-1845-5f8a-9b0b-afd02432b95e",
      "slug": "fruits-and-vegetables",
      "name": "Fruits and Vegetables",
      "color": null
    },
    {
      "id": "350013f8-2f45-510a-9b9f-63b3c7f40dc9",
      "slug": "risotto-recipes",
      "name": "Risotto Recipes",
      "color": null
    },
    {
      "id": "2fdaa6b0-35ed-5dbf-a615-3a99d1a5e4ef",
      "slug": "mushrooms",
      "name": "Mushrooms",
      "color": null
    },
    {
      "id": "9b1d5e14-edc0-5e19-9249-8efcbd50f025",
      "slug": "valentine-s-day",
      "name": "Valentine's Day",
      "color": null
    },
    {
      "id": "05662fa4-ba65-5bba-866e-4629892427a7",
      "slug": "italian",
      "name": "Italian",
      "color": null
    },
    {
      "id": "14f8b185-3b14-5647-8706-acca91b13af0",
      "slug": "main-dishes",
      "name": "Main Dishes",
      "color": null
    },
    {
      "id": "68816337-92bb-5b32-b7b5-d47b4d3c179c",
      "slug": "rice",
      "name": "Rice",
      "color": null
    },
    {
      "id": "1c9a3039-6d9f-5178-961e-8ff585919d81",
      "slug": "valentine-s-day-dinner-recipes",
      "name": "Valentine's Day Dinner Recipes",
      "color": null
    },
    {
      "id": "e09cd98a-c038-53f2-b08a-00f6534987bc",
      "slug": "recipes",
      "name": "Recipes",
      "color": null
    },
    {
      "id": "2212a3f7-edc9-5b0a-9793-cb9d18874a75",
      "slug": "chanterelle-mushroom-recipes",
      "name": "Chanterelle Mushroom Recipes",
      "color": null
    }
  ],
  "related_recipe_ids": [],
  "recipe_notes": [],
  "storage_notes": [],
  "source": {
    "name": "Allrecipes",
    "url": "https://www.allrecipes.com/recipe/150033/gorgonzola-and-wild-mushroom-risotto"
  },
  "public": true,
  "updated_at": 1790949858,
  "revision": 1
}
