{
  "$schema": "../../schemas/recipe.schema.json",
  "schema_version": 1,
  "id": "944373d9-8794-5f0e-be15-09b2199261d2",
  "slug": "chocolate-beer-cupcakes-with-whiskey-filling-and-irish-cream-icing",
  "name": "Chocolate Beer Cupcakes With Whiskey Filling And Irish Cream Icing",
  "recipe_type": "dessert",
  "brief_description": "Chocolate beer cupcakes with Irish whiskey-flavored chocolate cream filling and a delectable Irish cream frosting — perfect for a St. Patrick's Day party!",
  "cuisine": "Irish",
  "instructions": [
    {
      "position": 1,
      "text": "Preheat the oven to 350 degrees F (175 degrees C). Line 24 muffin cups with paper liners."
    },
    {
      "position": 2,
      "text": "Bring Irish stout beer and 1 cup butter to a boil in a saucepan and set aside until butter has melted, stirring occasionally. Mix in cocoa powder until smooth."
    },
    {
      "position": 3,
      "text": "Whisk together flour, sugar, baking soda, and salt in a bowl until thoroughly combined."
    },
    {
      "position": 4,
      "text": "Beat eggs with sour cream in a large bowl with an electric mixer on low until well combined. Slowly beat in beer mixture, then flour mixture; beat until batter is smooth."
    },
    {
      "position": 5,
      "text": "Divide batter between the prepared cupcake cups, filling each cup about 2/3 full."
    },
    {
      "position": 6,
      "text": "Bake in the preheated oven until a toothpick inserted into the center of a cupcake comes out clean, about 17 minutes."
    },
    {
      "position": 7,
      "text": "Cool the cupcakes completely. Cut cores out of the center of each cupcake with a sharp paring knife. Discard cores."
    },
    {
      "position": 8,
      "text": "Bring cream to a simmer in a saucepan over low heat; stir in bittersweet chocolate until melted."
    },
    {
      "position": 9,
      "text": "Mix in 2 tablespoons butter and Irish whiskey until butter is melted; let mixture cool to room temperature. Filling will thicken as it cools."
    },
    {
      "position": 10,
      "text": "Spoon the filling into the cored cupcakes."
    },
    {
      "position": 11,
      "text": "For frosting: Whip 1/2 cup butter in a bowl with an electric mixer until fluffy, 2 to 3 minutes."
    },
    {
      "position": 12,
      "text": "Set mixer to low speed and slowly beat in confectioners' sugar, one cup at a time, until frosting is smooth and spreadable. Beat in Irish cream liqueur; adjust the thickness of frosting with more confectioners' sugar if needed."
    },
    {
      "position": 13,
      "text": "Spread frosting on filled cupcakes."
    }
  ],
  "servings": 24,
  "cooking_time_minutes": 20,
  "preparation_time_minutes": 30,
  "rest_time_minutes": null,
  "difficulty": "hard",
  "image_url": "https://github.com/ffimnsr/pepper-meal-recipes/raw/master/recipes/v1/assets/by-id/944373d9-8794-5f0e-be15-09b2199261d2/cover.jpg",
  "video_url": "https://content.jwplatform.com/videos/FWRETldw-K3AjnAEN.mp4",
  "additional_media": [],
  "nutritional_information": {
    "@type": "NutritionInformation",
    "calories": "387 kcal",
    "carbohydrateContent": "49 g",
    "cholesterolContent": "61 mg",
    "fiberContent": "2 g",
    "proteinContent": "3 g",
    "saturatedFatContent": "13 g",
    "sodiumContent": "253 mg",
    "sugarContent": "37 g",
    "fatContent": "20 g",
    "unsaturatedFatContent": "0 g"
  },
  "dietary_labels": [],
  "allergens": [],
  "equipment": [],
  "ingredients": [
    {
      "ingredient_id": "72a26c7e-88bd-555b-9b71-d7af4b2103e5",
      "name": "irish stout beer such as guinness",
      "normalized_name": "irish stout beer such as guinness",
      "quantity": "1",
      "unit": "cup",
      "preparation": null,
      "position": 1
    },
    {
      "ingredient_id": "bbfbf60f-39b8-5e5a-9815-eba35d54e9b9",
      "name": "butter",
      "normalized_name": "butter",
      "quantity": "1",
      "unit": "cup",
      "preparation": null,
      "position": 2
    },
    {
      "ingredient_id": "06d14bb8-dcd1-5617-b682-3c3222146a21",
      "name": "unsweetened cocoa powder",
      "normalized_name": "unsweetened cocoa powder",
      "quantity": "0.75",
      "unit": "cup",
      "preparation": null,
      "position": 3
    },
    {
      "ingredient_id": "7ecff7d5-73ac-52f8-b020-2182bde86cbe",
      "name": "all-purpose flour",
      "normalized_name": "all-purpose flour",
      "quantity": "2",
      "unit": "cups",
      "preparation": null,
      "position": 4
    },
    {
      "ingredient_id": "fd1f5f7a-51aa-571d-8496-fa035af63968",
      "name": "white sugar",
      "normalized_name": "white sugar",
      "quantity": "2",
      "unit": "cups",
      "preparation": null,
      "position": 5
    },
    {
      "ingredient_id": "5a9cd2b5-fa45-5270-98c9-55a29531cc03",
      "name": "baking soda",
      "normalized_name": "baking soda",
      "quantity": "1.5",
      "unit": "teaspoons",
      "preparation": null,
      "position": 6
    },
    {
      "ingredient_id": "5158b18a-f73d-5768-a133-6b6c21cf5e98",
      "name": "salt",
      "normalized_name": "salt",
      "quantity": "0.75",
      "unit": "teaspoon",
      "preparation": null,
      "position": 7
    },
    {
      "ingredient_id": "39ba7c68-04ed-5bfd-9dca-c45ffe284f0c",
      "name": "large eggs",
      "normalized_name": "large eggs",
      "quantity": "2",
      "unit": "pieces",
      "preparation": null,
      "position": 8
    },
    {
      "ingredient_id": "2a756a13-d9a1-5257-b678-486a4ab2ac3d",
      "name": "sour cream",
      "normalized_name": "sour cream",
      "quantity": "0.66666668653488",
      "unit": "cup",
      "preparation": null,
      "position": 9
    },
    {
      "ingredient_id": "b22bc2e2-07c9-54aa-a04f-a6f6cd0810e9",
      "name": "heavy whipping cream",
      "normalized_name": "heavy whipping cream",
      "quantity": "0.66666668653488",
      "unit": "cup",
      "preparation": null,
      "position": 10
    },
    {
      "ingredient_id": "8367b4a3-d12d-50eb-aef5-5e8485515d0d",
      "name": "bittersweet chocolate",
      "normalized_name": "bittersweet chocolate",
      "quantity": "8",
      "unit": "ounces",
      "preparation": "chopped",
      "position": 11
    },
    {
      "ingredient_id": "bbfbf60f-39b8-5e5a-9815-eba35d54e9b9",
      "name": "butter",
      "normalized_name": "butter",
      "quantity": "2",
      "unit": "tablespoons",
      "preparation": null,
      "position": 12
    },
    {
      "ingredient_id": "48852316-3444-57ff-a1e0-d02f8225c290",
      "name": "irish whiskey",
      "normalized_name": "irish whiskey",
      "quantity": "1",
      "unit": "teaspoon",
      "preparation": "or more to taste",
      "position": 13
    },
    {
      "ingredient_id": "bbfbf60f-39b8-5e5a-9815-eba35d54e9b9",
      "name": "butter",
      "normalized_name": "butter",
      "quantity": "0.5",
      "unit": "cup",
      "preparation": "softened",
      "position": 14
    },
    {
      "ingredient_id": "23466612-d4e8-5f39-b905-a7f8e3b75dbf",
      "name": "confectioners' sugar",
      "normalized_name": "confectioners sugar",
      "quantity": "3",
      "unit": "cups",
      "preparation": "or more as needed",
      "position": 15
    },
    {
      "ingredient_id": "856e072e-d75f-5c7f-a313-918aa582cf30",
      "name": "irish cream liqueur such as baileys",
      "normalized_name": "irish cream liqueur such as baileys",
      "quantity": "3",
      "unit": "tablespoons",
      "preparation": "or more to taste",
      "position": 16
    }
  ],
  "categories": [
    {
      "id": "f478616f-a55d-517b-9b00-0fdd6d81e364",
      "slug": "dessert",
      "name": "Dessert"
    },
    {
      "id": "5eb76aa3-4648-5c14-8a74-b99b733b5ef3",
      "slug": "global-cuisines",
      "name": "Global Cuisines"
    },
    {
      "id": "76083b0a-f6ef-5c30-825b-e39e074509da",
      "slug": "european",
      "name": "European"
    },
    {
      "id": "15d08352-a4a8-517f-98a7-c34a0844c012",
      "slug": "uk-and-ireland",
      "name": "UK and Ireland"
    },
    {
      "id": "29c8c6e9-0361-5a84-8315-8a6846382fa4",
      "slug": "irish",
      "name": "Irish"
    }
  ],
  "tags": [
    {
      "id": "a4b5e8ec-448d-5625-ba32-c1b390f72278",
      "slug": "irish",
      "name": "Irish",
      "color": null
    },
    {
      "id": "dd4f7be4-2947-532a-9f8f-a4eb2cd626e8",
      "slug": "fillings",
      "name": "Fillings",
      "color": null
    },
    {
      "id": "6921ebf1-3ac3-50ab-8f8b-fe5e655d30a3",
      "slug": "chocolate-cake-recipes",
      "name": "Chocolate Cake Recipes",
      "color": null
    },
    {
      "id": "69edcd5d-d0cc-50c2-9d23-087e203987af",
      "slug": "liqueur-dessert-recipes",
      "name": "Liqueur Dessert Recipes",
      "color": null
    },
    {
      "id": "164d4127-2765-5952-8f24-ca336b15d5d6",
      "slug": "more-meal-ideas",
      "name": "More Meal Ideas",
      "color": null
    },
    {
      "id": "57ad2ba9-3a38-505c-bf63-45711fe65b88",
      "slug": "chocolate",
      "name": "Chocolate",
      "color": null
    },
    {
      "id": "f1bb5f6f-2324-5dbc-ae61-c9a6795d698f",
      "slug": "cocoa-powder-recipes",
      "name": "Cocoa Powder Recipes",
      "color": null
    },
    {
      "id": "c52c9397-422c-53d9-9524-2a65864b5dbc",
      "slug": "european",
      "name": "European",
      "color": null
    },
    {
      "id": "52593840-ac32-5603-8628-b6ebc4e308a3",
      "slug": "cupcake-recipes",
      "name": "Cupcake Recipes",
      "color": null
    },
    {
      "id": "2624b2ea-2212-589e-996c-65db8e6fc023",
      "slug": "cakes",
      "name": "Cakes",
      "color": null
    }
  ],
  "related_recipe_ids": [],
  "recipe_notes": [],
  "storage_notes": [],
  "source": {
    "name": "Allrecipes",
    "url": "https://www.allrecipes.com/recipe/220447/chocolate-beer-cupcakes-with-whiskey-filling-and-irish-cream-icing"
  },
  "public": true,
  "updated_at": 1790949859,
  "revision": 1
}
