{
  "$schema": "../../schemas/recipe.schema.json",
  "schema_version": 1,
  "id": "6f771696-126c-57bc-88be-a8b0e6e7ba75",
  "slug": "ginataang-bilo-bilo-langka-recipe",
  "name": "Ginataang Bilo bilo with Langka",
  "recipe_type": "dessert",
  "brief_description": "Ginataang Bilo-bilo with Langka is a Filipino meryenda dish composed of glutinous rice balls \u2013 locally known as bilo-bilo, coconut cream, sugar, sago pearls, and ripe jackfruit.",
  "cuisine": "Filipino",
  "instructions": [
    {
      "position": 1,
      "text": "Pour the water in a cooking pot. Bring to a boil."
    },
    {
      "position": 2,
      "text": "Add the coconut cream. Stir and cook until the mixture starts to boil again."
    },
    {
      "position": 3,
      "text": "Gradually stir-in the sugar."
    },
    {
      "position": 4,
      "text": "Add the ripe jackfruit. Cover and cook in low heat for 15 minutes."
    },
    {
      "position": 5,
      "text": "Add-in the bilo-bilo. Continue to cook for another 15 minutes while stirring every 3 minutes."
    },
    {
      "position": 6,
      "text": "Put-in the sago. Cook for 3 to 5 minutes."
    },
    {
      "position": 7,
      "text": "Transfer to a serving bowl. Serve."
    },
    {
      "position": 8,
      "text": "Share and enjoy!"
    }
  ],
  "servings": 6,
  "cooking_time_minutes": 40,
  "preparation_time_minutes": 5,
  "rest_time_minutes": null,
  "difficulty": "medium",
  "image_url": "https://github.com/ffimnsr/pepper-meal-recipes/raw/master/recipes/v1/assets/by-id/6f771696-126c-57bc-88be-a8b0e6e7ba75/cover.jpg",
  "video_url": null,
  "additional_media": [],
  "nutritional_information": {
    "@type": "NutritionInformation",
    "servingSize": "6 g",
    "calories": "599 kcal",
    "carbohydrateContent": "89 g",
    "proteinContent": "5 g",
    "fatContent": "28 g",
    "saturatedFatContent": "25 g",
    "sodiumContent": "10 mg",
    "fiberContent": "4 g",
    "sugarContent": "44 g"
  },
  "dietary_labels": [],
  "allergens": [],
  "equipment": [],
  "ingredients": [
    {
      "ingredient_id": "a56941c4-c122-5bf2-882d-88c43f5b119b",
      "name": "glutinous rice",
      "normalized_name": "glutinous rice",
      "quantity": "20",
      "unit": "pieces",
      "preparation": null,
      "position": 1
    },
    {
      "ingredient_id": "e00073cd-00af-5eb6-8e61-25f6aa98660e",
      "name": "jackfruit",
      "normalized_name": "jackfruit",
      "quantity": "20",
      "unit": "oz",
      "preparation": "sliced",
      "position": 2
    },
    {
      "ingredient_id": "b3093b3f-d99c-52fd-9035-976c0a2c55ea",
      "name": "water",
      "normalized_name": "water",
      "quantity": "2",
      "unit": "cups",
      "preparation": null,
      "position": 3
    },
    {
      "ingredient_id": "4c9107df-7fbe-5725-b3a4-15e722d53a83",
      "name": "coconut cream",
      "normalized_name": "coconut cream",
      "quantity": "2",
      "unit": "cups",
      "preparation": null,
      "position": 4
    },
    {
      "ingredient_id": "bdb57237-b976-59dd-abd1-dfb1d9e58253",
      "name": "granulated white sugar",
      "normalized_name": "granulated white sugar",
      "quantity": "3/4",
      "unit": "cup",
      "preparation": null,
      "position": 5
    },
    {
      "ingredient_id": "a193629d-a7eb-58ff-8688-f99ba7607427",
      "name": "tapioca pearl",
      "normalized_name": "tapioca pearl",
      "quantity": "1 1/2",
      "unit": "cups",
      "preparation": null,
      "position": 6
    }
  ],
  "categories": [
    {
      "id": "f478616f-a55d-517b-9b00-0fdd6d81e364",
      "slug": "dessert",
      "name": "Dessert"
    },
    {
      "id": "c87a4bcd-dcba-55e0-9c67-000df582dd77",
      "slug": "snack",
      "name": "Snack"
    }
  ],
  "tags": [
    {
      "id": "7a6eebc5-5705-5e56-a0c2-7dcf7a4691be",
      "slug": "bilo-bilo",
      "name": "bilo-bilo",
      "color": null
    },
    {
      "id": "6d87d4da-c799-5808-aeaa-158834132433",
      "slug": "ginataan",
      "name": "ginataan",
      "color": null
    },
    {
      "id": "c85087ed-77ad-577a-a122-c2d599ec6792",
      "slug": "meryenda",
      "name": "meryenda",
      "color": null
    },
    {
      "id": "a4b7cefa-f1ea-54c5-8156-16a3093745c6",
      "slug": "snack",
      "name": "snack",
      "color": null
    }
  ],
  "related_recipe_ids": [],
  "recipe_notes": [],
  "storage_notes": [],
  "source": {
    "name": "Panlasang Pinoy",
    "url": "https://panlasangpinoy.com/ginataang-bilo-bilo-langka-recipe/"
  },
  "public": true,
  "updated_at": 1581766680,
  "revision": 1
}
